{
  "fixtureVersion": 1,
  "suite": "h0-2-sanitized-agent-traces",
  "source": "synthetic",
  "clock": {
    "origin": "2030-01-01T00:00:00Z",
    "note": "Fixed synthetic clock; timestamps are not copied from user sessions."
  },
  "fixtures": [
    {
      "name": "plain-text-final",
      "source": "synthetic",
      "tags": ["model", "terminal"],
      "initialSnapshot": {"status": "model", "eventCursor": 0},
      "events": [
        {"seq": 1, "type": "created", "data": {"model": "fixture-model"}, "createdAt": "2030-01-01T00:00:00Z"},
        {"seq": 2, "type": "model_started", "data": {"round": 1, "runtimeRunId": "runtime-fixture-1"}, "createdAt": "2030-01-01T00:00:00Z"},
        {"seq": 3, "type": "model_completed", "data": {"round": 1, "runtimeRunId": "runtime-fixture-1", "content": "Synthetic final answer.", "reasoning": "", "toolCalls": [], "outcome": "content"}, "createdAt": "2030-01-01T00:00:00Z"},
        {"seq": 4, "type": "completed", "data": {}, "createdAt": "2030-01-01T00:00:00Z"}
      ],
      "checkpoints": [
        {"afterSeq": 4, "expectedState": {"status": "completed"}, "expectedTimeline": ["created", "model_started", "model_completed", "completed"]}
      ],
      "expectedTerminal": {"status": "completed", "eventType": "completed"}
    },
    {
      "name": "single-read-tool",
      "source": "synthetic",
      "tags": ["tool", "read"],
      "initialSnapshot": {"status": "model", "eventCursor": 0},
      "events": [
        {"seq": 1, "type": "created", "data": {"model": "fixture-model"}, "createdAt": "2030-01-01T00:00:00Z"},
        {"seq": 2, "type": "model_started", "data": {"round": 1, "runtimeRunId": "runtime-fixture-2a"}, "createdAt": "2030-01-01T00:00:00Z"},
        {"seq": 3, "type": "model_completed", "data": {"round": 1, "runtimeRunId": "runtime-fixture-2a", "content": "", "toolCalls": [{"id": "tool-fixture-read-1", "name": "read_file"}], "outcome": "tool_calls"}, "createdAt": "2030-01-01T00:00:00Z"},
        {"seq": 4, "type": "tool_started", "data": {"toolCallId": "tool-fixture-read-1", "name": "read_file", "arguments": "{\"path\":\"README.md\"}", "argumentAliases": []}, "createdAt": "2030-01-01T00:00:00Z"},
        {"seq": 5, "type": "tool_completed", "data": {"toolCallId": "tool-fixture-read-1", "name": "read_file", "arguments": "{\"path\":\"README.md\"}", "result": {"ok": true, "path": "README.md", "content": "Synthetic file."}, "outcome": "succeeded", "replayed": false}, "createdAt": "2030-01-01T00:00:00Z"},
        {"seq": 6, "type": "model_pending", "data": {"round": 2}, "createdAt": "2030-01-01T00:00:00Z"},
        {"seq": 7, "type": "model_started", "data": {"round": 2, "runtimeRunId": "runtime-fixture-2b"}, "createdAt": "2030-01-01T00:00:00Z"},
        {"seq": 8, "type": "model_completed", "data": {"round": 2, "runtimeRunId": "runtime-fixture-2b", "content": "Synthetic read summary.", "toolCalls": [], "outcome": "content"}, "createdAt": "2030-01-01T00:00:00Z"},
        {"seq": 9, "type": "completed", "data": {}, "createdAt": "2030-01-01T00:00:00Z"}
      ],
      "checkpoints": [
        {"afterSeq": 9, "expectedState": {"status": "completed"}, "expectedTimeline": ["created", "model_started", "model_completed", "tool_started", "tool_completed", "model_pending", "model_started", "model_completed", "completed"]}
      ],
      "expectedTerminal": {"status": "completed", "eventType": "completed"}
    },
    {
      "name": "multi-tool-stage",
      "source": "synthetic",
      "tags": ["tool", "grouping", "ordering"],
      "initialSnapshot": {"status": "model", "eventCursor": 0},
      "events": [
        {"seq": 1, "type": "created", "data": {"model": "fixture-model"}, "createdAt": "2030-01-01T00:00:00Z"},
        {"seq": 2, "type": "model_started", "data": {"round": 1, "runtimeRunId": "runtime-fixture-3a"}, "createdAt": "2030-01-01T00:00:00Z"},
        {"seq": 3, "type": "model_completed", "data": {"round": 1, "runtimeRunId": "runtime-fixture-3a", "content": "", "toolCalls": [{"id": "tool-fixture-list-1", "name": "list_files"}, {"id": "tool-fixture-read-2", "name": "read_file"}], "outcome": "tool_calls"}, "createdAt": "2030-01-01T00:00:00Z"},
        {"seq": 4, "type": "tool_started", "data": {"toolCallId": "tool-fixture-list-1", "name": "list_files", "arguments": "{\"path\":\".\"}", "argumentAliases": []}, "createdAt": "2030-01-01T00:00:00Z"},
        {"seq": 5, "type": "tool_completed", "data": {"toolCallId": "tool-fixture-list-1", "name": "list_files", "arguments": "{\"path\":\".\"}", "result": {"ok": true, "entries": ["README.md"]}, "outcome": "succeeded", "replayed": false}, "createdAt": "2030-01-01T00:00:00Z"},
        {"seq": 6, "type": "tool_started", "data": {"toolCallId": "tool-fixture-read-2", "name": "read_file", "arguments": "{\"path\":\"README.md\"}", "argumentAliases": []}, "createdAt": "2030-01-01T00:00:00Z"},
        {"seq": 7, "type": "tool_completed", "data": {"toolCallId": "tool-fixture-read-2", "name": "read_file", "arguments": "{\"path\":\"README.md\"}", "result": {"ok": true, "content": "Synthetic file."}, "outcome": "succeeded", "replayed": false}, "createdAt": "2030-01-01T00:00:00Z"},
        {"seq": 8, "type": "model_pending", "data": {"round": 2}, "createdAt": "2030-01-01T00:00:00Z"},
        {"seq": 9, "type": "model_started", "data": {"round": 2, "runtimeRunId": "runtime-fixture-3b"}, "createdAt": "2030-01-01T00:00:00Z"},
        {"seq": 10, "type": "model_completed", "data": {"round": 2, "runtimeRunId": "runtime-fixture-3b", "content": "Synthetic multi-tool summary.", "toolCalls": [], "outcome": "content"}, "createdAt": "2030-01-01T00:00:00Z"},
        {"seq": 11, "type": "completed", "data": {}, "createdAt": "2030-01-01T00:00:00Z"}
      ],
      "checkpoints": [
        {"afterSeq": 11, "expectedState": {"status": "completed"}, "expectedTimeline": ["created", "model_started", "model_completed", "tool_started", "tool_completed", "tool_started", "tool_completed", "model_pending", "model_started", "model_completed", "completed"]}
      ],
      "expectedTerminal": {"status": "completed", "eventType": "completed"}
    },
    {
      "name": "questionnaire-submit",
      "source": "synthetic",
      "tags": ["questionnaire", "resume"],
      "initialSnapshot": {"status": "model", "eventCursor": 0},
      "events": [
        {"seq": 1, "type": "created", "data": {"model": "fixture-model"}, "createdAt": "2030-01-01T00:00:00Z"},
        {"seq": 2, "type": "tool_started", "data": {"toolCallId": "tool-fixture-question-1", "name": "request_user_input", "arguments": "{}", "argumentAliases": []}, "createdAt": "2030-01-01T00:00:00Z"},
        {"seq": 3, "type": "user_input_required", "data": {"requestId": "request-fixture-1", "toolCallId": "tool-fixture-question-1", "title": "Synthetic choice", "reason": "fixture", "questions": [{"id": "choice", "question": "Choose A or B"}], "type": "questionnaire"}, "createdAt": "2030-01-01T00:00:00Z"},
        {"seq": 4, "type": "user_input_submitted", "data": {"requestId": "request-fixture-1", "toolCallId": "tool-fixture-question-1"}, "createdAt": "2030-01-01T00:00:00Z"},
        {"seq": 5, "type": "tool_completed", "data": {"toolCallId": "tool-fixture-question-1", "name": "request_user_input", "arguments": "{}", "result": {"answers": {"choice": "A"}}, "outcome": "succeeded", "replayed": false}, "createdAt": "2030-01-01T00:00:00Z"},
        {"seq": 6, "type": "waiting_credentials", "data": {"resumeStatus": "model", "reason": "user_input_submitted"}, "createdAt": "2030-01-01T00:00:00Z"},
        {"seq": 7, "type": "resumed", "data": {"status": "model"}, "createdAt": "2030-01-01T00:00:00Z"},
        {"seq": 8, "type": "model_started", "data": {"round": 2, "runtimeRunId": "runtime-fixture-4"}, "createdAt": "2030-01-01T00:00:00Z"},
        {"seq": 9, "type": "model_completed", "data": {"round": 2, "runtimeRunId": "runtime-fixture-4", "content": "Synthetic answer accepted.", "toolCalls": [], "outcome": "content"}, "createdAt": "2030-01-01T00:00:00Z"},
        {"seq": 10, "type": "completed", "data": {}, "createdAt": "2030-01-01T00:00:00Z"}
      ],
      "checkpoints": [
        {"afterSeq": 3, "expectedState": {"status": "waiting_user_input"}, "expectedTimeline": ["created", "tool_started", "user_input_required"]},
        {"afterSeq": 10, "expectedState": {"status": "completed"}, "expectedTimeline": ["created", "tool_started", "user_input_required", "user_input_submitted", "tool_completed", "waiting_credentials", "resumed", "model_started", "model_completed", "completed"]}
      ],
      "expectedTerminal": {"status": "completed", "eventType": "completed"}
    },
    {
      "name": "edit-authorization-accept",
      "source": "synthetic",
      "tags": ["authorization", "edit", "resume"],
      "initialSnapshot": {"status": "tools", "eventCursor": 0},
      "events": [
        {"seq": 1, "type": "created", "data": {"model": "fixture-model"}, "createdAt": "2030-01-01T00:00:00Z"},
        {"seq": 2, "type": "tool_started", "data": {"toolCallId": "tool-fixture-edit-1", "name": "propose_edit", "arguments": "{\"path\":\"demo.txt\"}", "argumentAliases": []}, "createdAt": "2030-01-01T00:00:00Z"},
        {"seq": 3, "type": "authorization_required", "data": {"authorizationId": "approval-fixture-edit-1", "toolCallId": "tool-fixture-edit-1", "action": "edit", "proposalId": "proposal-fixture-1", "path": "demo.txt", "diff": "-old\n+new", "decision": "", "requestedAt": "2030-01-01T00:00:00Z"}, "createdAt": "2030-01-01T00:00:00Z"},
        {"seq": 4, "type": "authorization_submitted", "data": {"authorizationId": "approval-fixture-edit-1", "toolCallId": "tool-fixture-edit-1", "decision": "accepted"}, "createdAt": "2030-01-01T00:00:00Z"},
        {"seq": 5, "type": "tool_completed", "data": {"toolCallId": "tool-fixture-edit-1", "name": "propose_edit", "arguments": "{\"path\":\"demo.txt\"}", "result": {"ok": true, "applied": true}, "outcome": "succeeded", "replayed": false}, "createdAt": "2030-01-01T00:00:00Z"},